{"run":70,"commit":"63ab849","metric":28,"metrics":{"best_2p_wins":7},"status":"discard","description":"gen 055 (stagnation=26): Mut2(7W/2L 2p, 2W 4p top2=3)=28; Elite(ORBIT=25.97,ENEMY=11.98,PROX=44)=19 (3W/6L 2p, 2W 4p top2=6 ALL TOP2!); X12(ORBIT=30.06,ENEMY=5.34)=16; X23(ORBIT=25.16,ENEMY=8.84)=15","timestamp":1779938192,"segment":0}
{"run":71,"commit":"6ef6eb6","metric":28,"metrics":{"best_2p_wins":6},"status":"discard","description":"gen 056 (stagnation=27): Elite(ORBIT=20.12,ENEMY=13.00,PROX=50)=28 (6W/3L 2p, 2W 4p top2=6 ALL TOP2! 5th time!); X23(ORBIT=22.83,ENEMY=7.04)=19 (4W/5L 2p, 2W 4p top2=3); Mut2(ORBIT=24.58,ENEMY=12.95)=16 (3W/6L 2p high-ENEMY hurts 2p); X12(ORBIT=29.32,ENEMY=5.68)=15 (5W 2p, 0W 4p — vice-HoF clones fail 4p)","timestamp":1779939421,"segment":0}
{"run":72,"commit":"149729e","metric":24,"metrics":{"best_2p_wins":5},"status":"discard","description":"gen 057 (stagnation=28): X23(ORBIT=33.08,ENEMY=7.82,SHIPS=0.132,PROX=44)=24 (5W/4L 2p, 3W 4p top2=3); Elite(ORBIT=24.92,ENEMY=14.59,SHIPS=0.078)=21 (5W/4L 2p, 0W 4p top2=6 ALL 2nd!); Mut2(ORBIT=21.12,ENEMY=7.48,SHIPS=0.069)=21 (5W 2p, 2W 4p); X12(ORBIT=27.86,ENEMY=5.82)=12 (3W/6L 2p, 1W 4p)","timestamp":1779940481,"segment":0}
{"run":73,"commit":"dbd88d1","metric":25,"metrics":{"best_2p_wins":6},"status":"discard","description":"gen 058 (stagnation=29): Mut2(ORBIT=26.57,ENEMY=16.45,SHIPS=0.079)=25 (6W/3L 2p, 2W 4p top2=3); X23(ORBIT=27.30,ENEMY=5.82,SHIPS=0.081 near-HoF!)=21 (6W/3L 2p, 1W 4p top2=1 — HoF params fail 4p on other seeds); Elite(ORBIT=30.81,ENEMY=9.50,PROD=21.51)=19 (3W/6L 2p, ALL TOP2 4p 7th time!); X12(ORBIT=29.48,ENEMY=6.45)=13","timestamp":1779941548,"segment":0}
{"run":74,"commit":"3e546fb","metric":28,"metrics":{"best_2p_wins":7},"status":"discard","description":"gen 059 (stagnation=30): X12(ORBIT=29.98,ENEMY=6.17,SHIPS=0.137)=28 (7W/2L 2p, 2W 4p top2=3 — vice-HoF direction best 2p!); Elite(ORBIT=31.99,ENEMY=15.53,SHIPS=0.079)=24 (4W/5L 2p, 3W 4p top2=6 ALL TOP2 8th time!); Mut2(ORBIT=31.86,ENEMY=6.41,SHIPS=0.085)=16; X23(ORBIT=23.58,ENEMY=4.52,SHIPS=0.053)=10","timestamp":1779942605,"segment":0}
{"run":75,"commit":"2361152","metric":25,"metrics":{"best_2p_wins":6},"status":"discard","description":"gen 060 (stagnation=31): X12(ORBIT=28.51,ENEMY=5.49,SHIPS=0.131)=25 (6W/3L 2p, 2W 4p top2=3); Mut2(ORBIT=30.04,ENEMY=12.35,SHIPS=0.082)=24 (5W 2p, 3W 4p); Elite(ORBIT=29.93,ENEMY=8.14,PROX=44)=17 (3W/6L 2p, ALL TOP2 4p 9th time!); X23(ORBIT=25.71,PROD=19.25)=12 (0W 4p — high PROD no help)","timestamp":1779943656,"segment":0}
{"run":76,"commit":"123fe96","metric":27,"metrics":{"best_2p_wins":8},"status":"discard","description":"gen 061 (stagnation=32): Mut2(ORBIT=35 MAX,ENEMY=11.03,SHIPS=0.069)=27 (8W/1L 2p — lucky seed! but 1W 4p); X12(ORBIT=28.39,ENEMY=6.16)=20 (5W 2p, 1W 4p top2=3); X23(ORBIT=30.25,ENEMY=7.98)=15; Elite(ORBIT=33.31,ENEMY=5.38)=16 (2W/7L 2p — ~ORBIT=33 hurts 2p); ORBIT max capped at 32 going forward","timestamp":1779944803,"segment":0}
{"run":77,"commit":"5adb824","metric":28,"metrics":{"best_2p_wins":7},"status":"discard","description":"gen 062 (stagnation=33): Elite(ORBIT=32.00,ENEMY=7.05,SHIPS=0.147,PROX=44)=28 (7W/2L 2p, 1W 4p top2=5); Mut2(ORBIT=25.70,ENEMY=5.65)=20 (5W 2p); X12(ORBIT=31.97,ENEMY=5.53)=15; X23(ORBIT=32.00,ENEMY=4.63)=15 (2W/7L 2p — low ENEMY with high ORBIT hurts 2p)","timestamp":1779945863,"segment":0}
{"run":78,"commit":"8fe6d49","metric":22,"metrics":{"best_2p_wins":6},"status":"discard","description":"gen 063 (stagnation=34): Mut2(ORBIT=21.92,ENEMY=5.68,SHIPS=0.137)=22 (6W/3L 2p, 1W 4p top2=2); Elite(ORBIT=32,ENEMY=9.75,SHIPS=0.200)=20 (4W/5L 2p, ALL TOP2 4p 10th time!); X12(ORBIT=30.17,ENEMY=6.29)=18; X23(ORBIT=27.63,ENEMY=6.01 near-HoF)=18 (4W/5L 2p — near-HoF clone fails yet again)","timestamp":1779946705,"segment":0}
{"run":79,"commit":"946f686","metric":30,"metrics":{"best_2p_wins":6},"status":"discard","description":"gen 064 (stagnation=35): Elite(ORBIT=21.50,ENEMY=3.28,SHIPS=0.112,PROX=50,COMPOUND=7.38)=30 (6W/3L 2p, 3W 4p top2=ALL 6 — 11th ALL-TOP2! best stagnation score); Mut2(ORBIT=27.26,ENEMY=9.97,COMPOUND=23.72)=22 (6W 2p, 1W 4p); X12(ORBIT=27.01,ENEMY=6.09)=14; X23(ORBIT=30.67,ENEMY=6.30)=12 (2W/7L 2p)","timestamp":1748390400,"segment":0}
{"run":80,"commit":"603724e","metric":21,"metrics":{"best_2p_wins":5},"status":"discard","description":"gen 065 (stagnation=36, ultra-deep): Elite(ORBIT=26.46,ENEMY=3.14,SHIPS=0.089)=21 (4W/5L 2p, 2W 4p top2=5); X23(HoFxvice-HoF ORBIT=29.99,ENEMY=4.36,SHIPS=0.070)=21 tied; Mut2(ORBIT=24.95,ENEMY=8.88,COMPOUND=24.27)=18; X12(vice-HoF near-clone ORBIT=29.49,ENEMY=5.60)=18 — sharp drop from gen064=30, seed=9 unfavorable","timestamp":1748394000,"segment":0}
{"run":81,"commit":"7068fdd","metric":34,"metrics":{"best_2p_wins":8},"status":"discard","description":"gen 066 (stagnation=37): Mut2(ORBIT=32.00,ENEMY=4.14,SHIPS=0.097,PROX=48.3,COMPOUND=11.26)=34 VICE-HOF TIER! 8W/1L 2p + 3W 4p top2=4; X12(ORBIT=27.46,ENEMY=5.58)=24 (7W/2L 2p); X23(COMPOUND=21.19,ORBIT=22.87)=12; Elite(ORBIT=20,ENEMY=2.33)=8 (ultra-low ENEMY killed 2p)","timestamp":1748397600,"segment":0}
