{"type":"config","name":"orbit-wars-agent-evolution","metricName":"best_fitness","metricUnit":"pts","bestDirection":"higher"}
{"run":1,"commit":"37d1db6","metric":25,"metrics":{"best_2p_wins":6},"status":"discard","description":"gen 001: X12 crossover(OrbitalDom,Berserker) best; Elite(OrbitalDom clone) worst in 2p","timestamp":1779817442,"segment":0}
{"run":2,"commit":"2ec994e","metric":23,"metrics":{"best_2p_wins":4},"status":"discard","description":"gen 002: Elite(OrbDom HoF) fitness=23; X23 dominates 2p(7W) but 0 4p wins — 2p/4p tradeoff persists","timestamp":1779818903,"segment":0}
{"run":3,"commit":"2303269","metric":22,"metrics":{"best_2p_wins":5},"status":"discard","description":"gen 003: Mut2(mutated X23-g002) best=22; balanced 2p/4p; X12 crossover(OrbDom,X23) collapsed in 4p again","timestamp":1779820837,"segment":0}
{"run":4,"commit":"c8285be","metric":22,"metrics":{"best_2p_wins":5},"status":"discard","description":"gen 004: plateau at 22; OrbDom Elite got 0 4p wins — HoF likely seed-specific; X12 crossover won this time","timestamp":1779822250,"segment":0}
{"run":5,"commit":"5faa2ad","metric":22,"metrics":{"best_2p_wins":5},"status":"discard","description":"gen 005: plateau 3rd straight gen at 22; stagnation detector fires for gen 006 (wide-explore sigma=0.30)","timestamp":1779823715,"segment":0}
{"run":6,"commit":"e5966bd","metric":31,"metrics":{"best_2p_wins":7},"status":"keep","description":"gen 006: stagnation-break fired (sigma=0.30); Mut2(mutated X23-g005) achieves fitness=31 — new HoF record, 7W/2L 2p + 3W 4p","timestamp":1779825286,"segment":0}
{"run":7,"commit":"9f14628","metric":31,"metrics":{"best_2p_wins":9},"status":"discard","description":"gen 007: X12 ties HoF at 31 with PERFECT 9W/0L 2p record but only 1 4p win; X23 went 0W/9L 2p with 3 4p wins — extreme specialization","timestamp":1779826613,"segment":0}
{"run":8,"commit":"8f933e5","metric":26,"metrics":{"best_2p_wins":7},"status":"discard","description":"gen 008: Elite(X12-g007 clone)=26, 7W/2L 2p; stagnation reset (gen007 tied HoF=31); HoF remains Mut2-g006","timestamp":1779828098,"segment":0}
{"run":9,"commit":"f987cef","metric":33,"metrics":{"best_2p_wins":8},"status":"keep","description":"gen 009: Mut2-g009 (mutant of Elite-g008 2nd place) achieves fitness=33 — new HoF! 8W/1L 2p + 2W 4p + top2=5; DIST_MULT=0.56 slightly higher but OVEREXTEND_MULT=0.22 very low","timestamp":1779830381,"segment":0}
{"run":10,"commit":"2ccc711","metric":23,"metrics":{"best_2p_wins":5},"status":"discard","description":"gen 010: X12-g010 best=23; Elite(Mut2-g009 clone) fell to 18 — HoF clone variance; all agents tightly clustered 18-23; stagnation_count=1","timestamp":1779832008,"segment":0}
{"run":11,"commit":"4906162","metric":27,"metrics":{"best_2p_wins":6},"status":"discard","description":"gen 011: Mut2-g011 best=27; Elite(HoF clone)=25 — consistent HoF underperformance; stagnation_count=2; Mut2 pattern dominates crossovers again","timestamp":1779834665,"segment":0}
{"run":12,"commit":"a4a6ed4","metric":25,"metrics":{"best_2p_wins":6},"status":"discard","description":"gen 012: Mut2-g012 best=25; Elite(HoF clone) 0 4p wins again; stagnation_count=3 — wide-explore fires for gen 013","timestamp":1779836007,"segment":0}
{"run":13,"commit":"edeb0b5","metric":28,"metrics":{"best_2p_wins":7},"status":"discard","description":"gen 013: wide-explore Elite struggled (2W/7L 2p ETA_MULT shot up to 1.40); X23-g013 best=28 (7W/2L 2p, 2W 4p) — crossover of X12×Elite from gen012; stagnation_count now 4","timestamp":1779837224,"segment":0}
{"run":14,"commit":"a228bb2","metric":33,"metrics":{"best_2p_wins":7},"status":"discard","description":"gen 014: X12-g014 ties HoF at 33 (7W/2L 2p, 4W 4p top2=4) — more 4p wins than HoF; ENEMY_MULT=4.50 very low, COMPOUND_MULT=6.48 high, PROXIMITY_DIST=44.92 huge; stagnation resets; Mut2 collapsed to fitness=3","timestamp":1779838326,"segment":0}
{"run":15,"commit":"f87d874","metric":34,"metrics":{"best_2p_wins":7},"status":"keep","description":"gen 015: X23-g015 new HoF=34! 7W/2L 2p + 4W 4p + top2=5; PROD_MULT=14.82 (highest), SHIPS_MULT=0.103 (lowest), PROXIMITY_DIST=44.49 (near full-board); inherited X12-g014 wide-proximity archetype","timestamp":1779839369,"segment":0}
{"run":16,"commit":"9da2f41","metric":31,"metrics":{"best_2p_wins":7},"status":"discard","description":"gen 016: X23-g016 best=31; Elite(HoF clone) 0W/9L 2p collapse; stagnation_count=1; X23 pattern continues to dominate over clones","timestamp":1779840564,"segment":0}
{"run":17,"commit":"af8fcb8","metric":22,"metrics":{"best_2p_wins":6},"status":"discard","description":"gen 017: tied X12/X23 both at 22; HoF clone=18; sharp regression from 31; stagnation_count=2","timestamp":1779841734,"segment":0}
{"run":18,"commit":"67d8634","metric":24,"metrics":{"best_2p_wins":7},"status":"discard","description":"gen 018: Mut2-g018 best=24; Elite(HoF clone)=15; X12 strong 2p(7W) but 0 4p wins; stagnation_count=3 — wide-explore fires for gen 019","timestamp":1779842874,"segment":0}
{"run":19,"commit":"5d6a2aa","metric":31,"metrics":{"best_2p_wins":8},"status":"discard","description":"gen 019: X23-g019=31 (8W/1L 2p, 2W 4p) — strong 2p but low 4p; wide-explore Elite mediocre=21; stagnation_count=4 fires wide-explore again","timestamp":1779843956,"segment":0}
{"run":20,"commit":"ffd1638","metric":22,"metrics":{"best_2p_wins":6},"status":"discard","description":"gen 020: Elite-g020(wide-explore) 5W 4p but 2W 2p=22; Mut2 6W 2p but 1W 4p=22; 2p/4p tradeoff maximally visible; stagnation_count=5","timestamp":1779845156,"segment":0}
{"run":21,"commit":"355076d","metric":30,"metrics":{"best_2p_wins":7},"status":"discard","description":"gen 021: Elite-g021(wide-explore of 4p-specialist)=30; 6W 2p + 3W 4p + top2=6 — best balanced result since gen016; X12=25; stagnation_count=6","timestamp":1779846205,"segment":0}
{"run":22,"commit":"776c296","metric":27,"metrics":{"best_2p_wins":6},"status":"discard","description":"gen 022: X12-g022=27 (6W/3L 2p, 3W 4p); Elite(wide-explore) weak again=14; stagnation_count=7","timestamp":1779847224,"segment":0}
{"run":23,"commit":"9d53978","metric":30,"metrics":{"best_2p_wins":7},"status":"discard","description":"gen 023: X23-g023=30 (6W/3L 2p, 4W 4p, top2=4); X12=25; Elite collapsed=11; X23 consistently best but plateau at 30; stagnation_count=8","timestamp":1779848141,"segment":0}
{"run": 24, "commit": "97e2496", "metric": 24, "metrics": {"best_2p_wins": 6}, "status": "discard", "description": "gen 024: X23-g024=24 (6W/3L 2p, 2W 4p, top2=2); Elite=20 (1W 4p, top2=6 all-survival); wide-explore keeps stagnating below HoF=34; X23 2p dominance but weak 4p", "timestamp": 1779849389, "segment": 0}
{"run": 25, "commit": "ec2ba5b", "metric": 24, "metrics": {"best_2p_wins": 7}, "status": "discard", "description": "gen 025: X12=24 (7W/2L 2p, 1W 4p, top2=1); 2p specialist again; Elite ORBIT=34.43 survives 4p (2W,top2=5) but weak 2p; 10 gens stagnation \u2014 modifying strategy", "timestamp": 1779850411, "segment": 0}
{"run": 26, "commit": "af40e6a", "metric": 30, "metrics": {"best_2p_wins": 6}, "status": "discard", "description": "gen 026: X23-g026=30 (6W/3L 2p, 4W 4p, top2=4); HoF\u00d72nd crossover works! X12(HoF\u00d71st)=9 failed; deep stagnation strategy produced best in 5 gens", "timestamp": 1779851449, "segment": 0}
{"run": 27, "commit": "ac0e0ea", "metric": 28, "metrics": {"best_2p_wins": 7}, "status": "discard", "description": "gen 027: Mut2=28 (7W/2L 2p, 2W 4p, top2=3); HoF crossovers fail again (X12=12, X23=16); SHIPS_MULT contamination from population (0.51-0.57) prevents HoF genes working", "timestamp": 1779852570, "segment": 0}
{"run": 28, "commit": "e0642da", "metric": 30, "metrics": {"best_2p_wins": 8}, "status": "discard", "description": "gen 028: HoF near-clone(X12)=30 (8W/1L 2p, 2W 4p); Mut2=30 (7W 2p, 3W 4p); HoF dominates 2p but 4p limited by seed variance; tied at 30", "timestamp": 1779853499, "segment": 0}
{"run": 29, "commit": "464571b", "metric": 28, "metrics": {"best_2p_wins": 6}, "status": "discard", "description": "gen 029: Elite=28 (6W/3L 2p, 2W 4p, top2=6); 3 low-SHIPS agents split wins \u2014 convergent pop hurts; PROD=18.41+SHIPS=0.098 Mut2 collapsed at 12; diversity required", "timestamp": 1779854527, "segment": 0}
{"run": 30, "commit": "09b0a25", "metric": 28, "metrics": {"best_2p_wins": 8}, "status": "discard", "description": "gen 030: X23(PROD=15.50,SHIPS=0.417)=28 (8W/1L 2p, 1W 4p); Mut2(SHIPS=0.094)=15 4p-specialist; 2p-vs-4p split persists; 15 gens stagnation", "timestamp": 1779855622, "segment": 0}
{"run": 31, "commit": "f46b769", "metric": 24, "metrics": {"best_2p_wins": 6}, "status": "discard", "description": "gen 031: X23(PROD=17.10,SHIPS=0.140,PROX=44.0,ENEMY=6.73)=24; near-HoF params but 2p/4p split; Mut2(SHIPS=0.102)=16 4p-only; 16 gens stagnation", "timestamp": 1779856620, "segment": 0}
{"run": 32, "commit": "359aff2", "metric": 28, "metrics": {"best_2p_wins": 7}, "status": "discard", "description": "gen 032: Elite(PROD=20.69,SHIPS=0.157,OVER=0.798)=28 (7W/2L 2p); HoF near-clone=9 \u2014 crushed by PROD=20.69; high PROD dominates even with high OVEREXTEND; 17 gens stagnation", "timestamp": 1779857825, "segment": 0}
{"run": 33, "commit": "dbd9093", "metric": 25, "metrics": {"best_2p_wins": 7}, "status": "discard", "description": "gen 033: X12(HoF near-clone PROD=14.69,PROX=43.5)=25 (7W/2L 2p); Elite(PROD=26.88,PROX=27.6)=16 \u2014 PROX too low killed it; PROX is as critical as PROD; 18 gens stagnation", "timestamp": 1779859017, "segment": 0}
{"run": 34, "commit": "96d909c", "metric": 22, "metrics": {"best_2p_wins": 6}, "status": "discard", "description": "gen 034: Mut2=X23=22 tied; PROX<35 again crippled Elite(23.36) and Mut2 at 16; X12(HoF near-clone,PROX=45.2)=18; modified evolve.py to clamp PROX>=40 in wide-explore", "timestamp": 1779860186, "segment": 0}
{"run": 35, "commit": "1cb84be", "metric": 28, "metrics": {"best_2p_wins": 9}, "status": "discard", "description": "gen 035: X12(PROD=14.76,SHIPS=0.095,ENEMY=6.72)=28 (9W/0L 2p PERFECT! 0W 4p); ultimate 2p specialist; 4p completely fails; 20 gens stagnation", "timestamp": 1779861276, "segment": 0}
{"run": 36, "commit": "f2ef72b", "metric": 26, "metrics": {"best_2p_wins": 7}, "status": "discard", "description": "gen 036: Elite(SHIPS=0.057)=26 (7W/2L 2p, 0W 4p top2=5); Mut2(ENEMY=16.21)=24 (3W 2p, 5W 4p RECORD!); if combined 7*3+5*2+5=36 would beat HoF; 21 gens stagnation", "timestamp": 1779862464, "segment": 0}
{"run":37,"commit":"07d8d53","metric":29,"metrics":{"best_2p_wins":7},"status":"discard","description":"gen 037: Elite(SHIPS=0.044,PROD=18.08)=29 (7W/2L 2p, 1W 4p, top2=6); X12(HoF near-clone)=24 (7W/2L 2p); fusion X23(ENEMY=10.15) collapsed 0W/9L 2p; ENEMY must stay <7 for 2p; 22 gens stagnation","timestamp":1779863754,"segment":0}
{"run":38,"commit":"6e9879b","metric":28,"metrics":{"best_2p_wins":6},"status":"discard","description":"gen 038: Elite(ORBIT=31.93,SHIPS=0.042)=28 (6W/3L 2p, 2W 4p, top2=6); all three tied 6W/3L 2p; X23(SHIPS=0.034,ENEMY=4.01,PROX=37.24) 0W/9L — PROX<40 again fatal; 23 gens stagnation","timestamp":1779865162,"segment":0}
{"run":39,"commit":"c899754","metric":33,"metrics":{"best_2p_wins":7},"status":"discard","description":"gen 024 (new run, deep stagnation=9): Elite-g024=33 (7W/2L 2p, 3W 4p, top2=6) — wide-explore Mut2-g023 PROX=50.0,ORBIT=18.24; closest to HoF since gen015! X23-g024=25; X12-g024=6 (HoF near-clone collapsed)","timestamp":1779902669,"segment":0}
{"run":40,"commit":"eb66de6","metric":26,"metrics":{"best_2p_wins":7},"status":"discard","description":"gen 025 (deep stagnation=10): Elite-g025=26 (7W/2L 2p, 0W 4p, top2=5); X23-g025=19; X12-g025=18 (3W 4p); Mut2-g025=15 — wide-explore Elite lost 4p edge vs gen024","timestamp":1779904132,"segment":0}
{"run":41,"commit":"e470331","metric":27,"metrics":{"best_2p_wins":6},"status":"discard","description":"gen 026 (stagnation=11): Elite-g026=27 (6W/3L 2p, 2W 4p, top2=5, ENEMY=8.35,PROX=50,PROD=15.27); X12 near-clone=14 (2W/7L 2p); Mut2=19,X23=18","timestamp":1779905526,"segment":0}
{"run":42,"commit":"dff479e","metric":25,"metrics":{"best_2p_wins":6},"status":"discard","description":"gen 027 (stagnation=12): X23-g027=25 (6W/3L 2p, 2W 4p, top2=3); Elite-g027=21 (PROX=40 crippled 2p 3W/6L); X12 HoF near-clone=13; Mut2=19 — PROX<44 confirmed catastrophic","timestamp":1779906832,"segment":0}
{"run":43,"commit":"5cb627f","metric":26,"metrics":{"best_2p_wins":6},"status":"discard","description":"gen 028 (stagnation=13): Elite-g028=26 (6W/3L 2p, 1W 4p, top2=6); X12 HoF near-clone=19; Mut2=18; X23=15 (ENEMY=9.23+PROX=44 weak)","timestamp":1779908148,"segment":0}
{"run":44,"commit":"b13f33b","metric":36,"metrics":{"best_2p_wins":9},"status":"keep","description":"gen 029 (stagnation=13→RESET): Elite-g029=36 NEW HOF! PERFECT 9W/0L 2p + 2W 4p top2=5; PROX=50,ENEMY=6.81,ORBIT=27.75,SHIPS=0.087,PROD=15.97 — wide-explore of Elite-g028","timestamp":1779909681,"segment":0}
{"run":45,"commit":"ece341f","metric":32,"metrics":{"best_2p_wins":8},"status":"discard","description":"gen 030 (stagnation=1): Elite-g030=32 (8W/1L 2p, 1W 4p, top2=6) exact HoF clone dropped 36->32 via seed variance; X12(PROX=44,PROD=23.7)=7 (0W/9L 2p catastrophic); X23=21; Mut2=18","timestamp":1779911026,"segment":0}
{"run":46,"commit":"983a167","metric":29,"metrics":{"best_2p_wins":7},"status":"discard","description":"gen 031 (stagnation=2): Elite(HoF clone)=29 (7W/2L 2p, 1W 4p); X12=21; Mut2=19 (3W 4p); X23=9 (ENEMY=5.1 too low) — HoF config variance: 36/32/29 on 3 seeds","timestamp":1779912070,"segment":0}
{"run":47,"commit":"989342e","metric":27,"metrics":{"best_2p_wins":7},"status":"discard","description":"gen 032 (stagnation=3): Elite(HoF clone)=27 (7W/2L 2p, 0W 4p); X23=24 (3W 4p); Mut2=18; X12(ORBIT=35)=9 (2W/7L — too extreme); HoF variance now 36/32/29/27","timestamp":1779913213,"segment":0}
{"run":48,"commit":"c59ecb8","metric":22,"metrics":{"best_2p_wins":7},"status":"discard","description":"gen 033 (stagnation=4): X12-g033=22 (7W/2L 2p, PROX=50,ORBIT=24.27); Elite(ORBIT=34,PROD=22.9)=21 (4W/5L 2p); X23=19; Mut2=16 (4W 4p! but 1W/8L 2p)","timestamp":1779914269,"segment":0}
{"run":49,"commit":"81511c7","metric":24,"metrics":{"best_2p_wins":6},"status":"discard","description":"gen 034 (stagnation=5): X23-g034=24 (6W/3L 2p, 2W 4p, PROX=50,ENEMY=6.49,PROD=11.73,ORBIT=16); X12=21 (ORBIT=35 ok this time); Elite(SHIPS=0.216,PROD=25)=15 — extreme SHIPS/PROD failed","timestamp":1779915315,"segment":0}
{"run":50,"commit":"ae4c8e4","metric":28,"metrics":{"best_2p_wins":7},"status":"discard","description":"gen 035 (stagnation=6): Mut2(ENEMY=4.67,ORBIT=35,SHIPS=0.173,PROX=50)=28 (7W/2L 2p, 2W 4p); X12(ENEMY=11.69,ORBIT=35,PROX=50)=25; Elite(PROX=44,PROD=8.5)=16; X23(PROD=24)=9 — deep stagnation activates gen 036","timestamp":1779916401,"segment":0}
{"run":51,"commit":"9a8d048","metric":25,"metrics":{"best_2p_wins":8},"status":"discard","description":"gen 036 (stagnation=7): X12-g036(HoF near-clone ENEMY=7.46,ORBIT=29.43,PROX=49.1)=25 (8W/1L 2p, 0W 4p top2=1); Elite(SHIPS=0.238,PROD=25.82,ORBIT=35)=19; X23(ENEMY=4.39)=18; Mut2(ENEMY=11.7)=16","timestamp":1779917495,"segment":0}
{"run":52,"commit":"0c88cbc","metric":30,"metrics":{"best_2p_wins":7},"status":"discard","description":"gen 037 (stagnation=8): X23-g037(PROD=19.78,SHIPS=0.186,ORBIT=33.77,ENEMY=7.18,PROX=44)=30 (7W/2L 2p, 3W 4p top2=3); Elite(ENEMY=9.07,ORBIT=27.96)=20; X12(HoF near-clone)=18; Mut2(SHIPS=0.24)=10","timestamp":1779918621,"segment":0}
{"run":53,"commit":"879944a","metric":33,"metrics":{"best_2p_wins":7},"status":"discard","description":"gen 038 (stagnation=9): Elite(PROD=15.47,SHIPS=0.175,ORBIT=35,ENEMY=7.18,PROX=44)=33 (7W/2L 2p, 3W 4p top2=6); X12(HoF near-clone ENEMY=6.34,ORBIT=28,SHIPS=0.079)=26; X23(SHIPS=0.050)=15; Mut2(PROD=6.36,ENEMY=9.18)=4","timestamp":1779919711,"segment":0}
{"run":54,"commit":"3051f12","metric":22,"metrics":{"best_2p_wins":4},"status":"discard","description":"gen 039 (stagnation=10): Elite(SHIPS=0.239,ORBIT=35,ENEMY=4.85)=22 (4W/5L 2p — SHIPS toxic); Mut2(SHIPS=0.091,ENEMY=4.66,PROX=44)=22 tied; X23(SHIPS=0.135,ORBIT=35,ENEMY=5.68)=19; X12(HoF near-clone ENEMY=6.36,ORBIT=24.9)=15","timestamp":1779920963,"segment":0}
{"run":55,"commit":"0510fc7","metric":22,"metrics":{"best_2p_wins":5},"status":"discard","description":"gen 040 (stagnation=11): 3-way tie — Elite(SHIPS=0.20 clamped,ORBIT=35,ENEMY=6.07)=22; Mut2(SHIPS=0.098,ORBIT=27.16,ENEMY=5.53,PROX=44)=22 (6W/3L 2p best); X12(HoF near-clone SHIPS=0.083,ENEMY=7.04,ORBIT=29.91,PROX=47)=22; X23(ENEMY=4.50)=12","timestamp":1779922049,"segment":0}
{"run":56,"commit":"b8434eb","metric":24,"metrics":{"best_2p_wins":6},"status":"discard","description":"gen 041 (stagnation=12): Elite(PROD=26.24,SHIPS=0.20↓,ORBIT=32.25,ENEMY=5.68,PROX=44.4)=24 (6W/3L 2p, 0W 4p top2=6); X12(HoF near-clone ENEMY=6.86,ORBIT=28.91,SHIPS=0.088)=21 (3W 4p); X23(ORBIT=35,SHIPS=0.113)=18 (3W 4p); Mut2(ENEMY=4.82)=15","timestamp":1779923122,"segment":0}
{"run":57,"commit":"d830ba1","metric":24,"metrics":{"best_2p_wins":6},"status":"discard","description":"gen 042 (stagnation=13): X12(HoF near-clone ENEMY=7.64,ORBIT=26.93,SHIPS=0.091,PROX=50)=24 (6W/3L 2p, 2W 4p); Elite(ENEMY=3.82,PROD=28.35)=20; Mut2(ORBIT=34.14,SHIPS=0.083,ENEMY=6.28)=18 (3W 4p); X23(SHIPS=0.192,ORBIT=32.88)=16","timestamp":1779924140,"segment":0}
{"run":58,"commit":"f0c4f4b","metric":31,"metrics":{"best_2p_wins":8},"status":"discard","description":"gen 043 (stagnation=14): X23(ENEMY=4.02,SHIPS=0.189,ORBIT=24.27,PROX=46.5)=31 (8W/1L 2p, 2W 4p top2=3); X12(HoF near-clone ENEMY=6.43,ORBIT=25.50,SHIPS=0.085)=21; Elite(ENEMY=8.28,ORBIT=33.91)=19 (3W/6L); Mut2(PROD=27.96,SHIPS=0.20)=7","timestamp":1779925168,"segment":0}
{"run":59,"commit":"9677f3e","metric":23,"metrics":{"best_2p_wins":6},"status":"discard","description":"gen 044 (stagnation=15→ULTRA): Elite(ENEMY=2.18,SHIPS=0.20↓,ORBIT=26.69,PROX=50)=23 (6W/3L 2p, 0W 4p); X23(ENEMY=7.66,ORBIT=21.59,SHIPS=0.082)=21 (3W 4p); X12(HoF near-clone ENEMY=6.20,ORBIT=28.06,SHIPS=0.082)=19; Mut2=15","timestamp":1779926245,"segment":0}
{"run":60,"commit":"53d2cb0","metric":27,"metrics":{"best_2p_wins":7},"status":"discard","description":"gen 045 (stagnation=16→ULTRA): Elite(ENEMY=1.75,ORBIT=35,SHIPS=0.20,PROX=49.4)=27 (7W/2L 2p, 0W 4p top2=6); Mut2(ENEMY=10.01,ORBIT=23.03,SHIPS=0.085,PROX=50)=27 tied (5W/4L 2p, 4W 4p RECORD! top2=4); X12(vice-HoF clone ORBIT=14.99)=15; X23(HoF*vice crossover ORBIT=20.81)=9","timestamp":1779927388,"segment":0}
{"run":61,"commit":"c0dd274","metric":29,"metrics":{"best_2p_wins":8},"status":"discard","description":"gen 046 (stagnation=17): Elite(ENEMY=2.25,ORBIT=24.87,SHIPS=0.20,PROX=50)=29 (8W/1L 2p, 0W 4p); X12(vice-HoF ORBIT=13.19,ENEMY=6.86)=21 (3W/6L 2p, 4W 4p); X23(HoF*vice ORBIT=25.49)=16; Mut2(ENEMY=11.09)=12","timestamp":1779928645,"segment":0}
{"run":62,"commit":"4165a48","metric":26,"metrics":{"best_2p_wins":6},"status":"discard","description":"gen 047 (stagnation=18): Elite(ENEMY=4.43,ORBIT=31.22,SHIPS=0.20,PROX=50)=26 (6W/3L 2p, 1W 4p top2=6); X12(vice-HoF ORBIT=13,ENEMY=6.33)=19 (3W 4p); Mut2(ENEMY=6.75,ORBIT=14.53,PROX=44)=18; X23(PROD=25.05,ORBIT=12.32)=15","timestamp":1779929822,"segment":0}
{"run":63,"commit":"adc1967","metric":28,"metrics":{"best_2p_wins":6},"status":"discard","description":"gen 048 (stagnation=19): Elite(ENEMY=4.26,ORBIT=35,SHIPS=0.196,PROX=50)=28 (6W/3L 2p, 2W 4p top2=6 ALL TOP2!); X23(HoF×vice-HoF ORBIT=8.24,ENEMY=5.92)=19 (4W 2p, 2W 4p); X12(vice-HoF ORBIT=14.5,ENEMY=7.23)=16; Mut2(ORBIT=12.6,ENEMY=5.55)=15","timestamp":1779930994,"segment":0}
{"run":64,"commit":"e2ba80a","metric":34,"metrics":{"best_2p_wins":9},"status":"discard","description":"gen 049 (stagnation=20): Elite(ORBIT=28.96,ENEMY=5.67,SHIPS=0.125,PROX=50)=34 PERFECT 9W/0L 2p + 1W 4p top2=5; Mut2(ORBIT=8.92,ENEMY=6.90)=22; X12(vice-HoF ORBIT=12.8)=15; X23(HoF×vice-HoF ORBIT=29.82,ENEMY=5.40)=7 (1W/8L 2p!)","timestamp":1779932125,"segment":0}
{"run":65,"commit":"77adc9e","metric":27,"metrics":{"best_2p_wins":6},"status":"discard","description":"gen 050 (stagnation=21): Mut2(ORBIT=8.93,ENEMY=7.74,SHIPS=0.179,PROX=44)=27 (6W/3L 2p, 3W 4p top2=3); X23(ORBIT=22.06,ENEMY=5.82)=20 (4W 2p, 2W 4p top2=4); Elite(ORBIT=35,ENEMY=5.24)=19 (4W 2p, 1W 4p top2=5); X12(vice-HoF near-clone ORBIT=28.12,ENEMY=5.48)=12 (4W 2p, 0W 4p — seed killed it)","timestamp":1779933173,"segment":0}
{"run":66,"commit":"1f981cb","metric":25,"metrics":{"best_2p_wins":5},"status":"discard","description":"gen 051 (stagnation=22): Elite(ORBIT=10.67,ENEMY=12.93,SHIPS=0.20↓,PROX=44)=25 (5W/4L 2p, 2W 4p top2=6 ALL TOP2!); Mut2(ORBIT=8.37,ENEMY=8.56)=19 (3W 2p, 3W 4p top2=4); X12(near-Elite049 ORBIT=30.26,ENEMY=5.23)=19 (6W/3L 2p, 0W 4p — 4p killed); X23(ORBIT=32.79,ENEMY=5.23,SHIPS=0.085)=15 (4W 2p, 1W 4p)","timestamp":1779934132,"segment":0}
{"run":67,"commit":"527718f","metric":25,"metrics":{"best_2p_wins":5},"status":"discard","description":"gen 052 (stagnation=23): X23(ORBIT=34.01,ENEMY=6.57,SHIPS=0.085,PROX=44.3)=25 (5W/4L 2p, 3W 4p top2=4); Elite(ORBIT=6.78,ENEMY=17.82)=24 (4W/5L 2p, 3W 4p top2=6 ALL TOP2!); X12(near-Elite049 ORBIT=28.85)=18 (6W/3L 2p, 0W 4p); Mut2=11","timestamp":1779935140,"segment":0}
{"run":68,"commit":"90af7d5","metric":26,"metrics":{"best_2p_wins":5},"status":"discard","description":"gen 053 (stagnation=24): Elite(ORBIT=25.94,ENEMY=5.88,SHIPS=0.111,PROX=50)=26 (5W/4L 2p, 3W 4p top2=5); X23(ORBIT=28.96,ENEMY=7.29,SHIPS=0.074)=20 (5W 2p, 1W 4p); Mut2=18 (4W 2p, 2W 4p); X12(near-Elite049 ORBIT=28.67)=14 (4W 2p, 0W 4p)","timestamp":1779936042,"segment":0}
{"run":69,"commit":"e9d9afc","metric":25,"metrics":{"best_2p_wins":7},"status":"discard","description":"gen 054 (stagnation=25): Mut2(mut X23-g053,7W/2L 2p,1W 4p top2=2)=25; Elite(ORBIT=20.27,ENEMY=8.70)=24 (5W/4L 2p, 2W 4p top2=5); X12(ORBIT=30.84)=17 (4W 2p, 1W 4p); X23(ORBIT=35 MAX,ENEMY=6.19)=12 (2W/7L 2p — max ORBIT kills 2p)","timestamp":1779937172,"segment":0}
